,NonCyberSecFile,Content
0,001-2015beyondobamanewcongressneed.txt,attitude play selfishness pig stock family vietnam loss entitlement take towards defines end right news give heterosexual married new year trend age known lived home institution america trusted doubt born levant reliable president civil research writes say likely save assault selfconfidence living bed goal warns today felt institution affluence decline empire refuse several value wealth sixty traditional end egypt mostly exhibiting infused baby american personality typical promoted expected parent enemy winona might unknown history survival film generation possible destruction figure police happens market home conquest wrote fate intellect fallout family come weakening influx frivolity young wish religion tv interrupted apply sign grandparent pioneer startling money pew defensiveness called contributor period society welfare far search help british ancient learn watching materialism military spawned one war commerce pessimism ryder live twoplus win center lying generation disdain teach protect since due high u love sir duty average cohabitation begin contrast five see followed define decadence relative elimination major divorce varied marriage boom strengthen diagnosed draft explanation something year appears notion mental glubb seem revival whatever report ease pursue made girl spirit long turmoil power people war mameluke study congress child sense nofault diplomat enters victimhood country empire longer obvious bomb old hatred boomer intent late assyria reached study foreigner state prejudiced record serve noted narrator disorder bc night marked life book brief envy expectation demonstration confirms age borderline dropped mean culture created still john back changed greed percent time
1,002-2015willamericacontinueitsslow.txt,take differently violate name claimed steadfast firestorm free today law enacted baby value law first intrusiveness toward taken selfdefense property perpetual limited believed become oath court left declaration statute dozen liberty american observation rejected u founding document modern concept invade given o wish socialism year express country rather slaughter writing borrowed majority fail trillion literally slow expressly believe going book limit protector discrete yet congressional lawyer unless framer secret deadly person say million subject freedom state lawful articulated government wade america roe rule president court paying direction sight traditional gotten baby wilson march dollar president legal private guaranteed restrained combination project sworn unlimited size wealthdistributing signed patriot due rule evil worship slip past never permit though cost powerless problem uphold whether earlier world write embrace force issued people choice billion lethal collective use small tax together make day life interest supreme abortion legacy behavior woodrow created still upon decision birthright kill permission work author correct process deep interest prolife european aspect guinness debt foreign enjoy every prohibition written consistent opine appreciate nt residing power travel privacy week thought regulate destruction radical group taxpayer natural spying continue around go demonstrates collected united need personal belong womb british leadership fisa one war rejection since duped v cent humanity constitution authorizes warrant constitutionally persuaded steady presumption mean transcendental candid congress truly declares even whomever dignity like simple change socalled bribe rich interfered abortion preexisting imagined infringe leader argued style interfere revealed finance delegate oneline time away know support accepting defines act end right done defending went issue year declaration domestic independence party regulated happened father association teaching stopping madisonian killed lawfully apparatus federal prohibit fetus inalienable money permitted enact individual search signature political allow exercise enacting vote stated thus hole reject want press principle speech take source judeochristian elect dollar spend others minute authorized prohibits act presidential liberty willingness focus agent interfering everyone without plea could jeffersonian
2,003-2015willnewcongressgetseriousa.txt,threat finally last recent arm maintain tough posturing imagine codified list shield part annual law clearly washington nato toward tougher incident senate impose sweden balance policy continued targeted ministry actually fault declared plan remarked uncle involving improve rogers tuner given specific serious credit must protect abandonment u house large think bipartisan little continues alexander russian defense crimea ally year add country near made report hence long longshot plan homeland began majority levy chairman sanction democratic modest freshly nuclear purpose rind back russia prick emphasis sector aggressive obama motivated million configure deter month new ballistic approved annexing preemptively increased troop threat government build curb president foe close paying remains republican lukashevich strengthening confirmed development cold vladmir west said sam bmdr document hearing failure another called abroad perfect trip far april usher approach deterring attention military ushered transponder remained never opposed senator officially position rala statement deploying lawmaker justifiability unwilling perhaps treaty iranian rethink violation use senator whole insisted missile soviet current official missile defense much still threatening permission bill december get joe commercial network early agreement asset european issue foreign defend system nt iran inf mike strategic might range stubbornness speed pin eastern order regional spokesman poland moved ensure stopped ukraine congressman thrill robust british leadership revelation one war tank since recall adaptive subcommittee deal also unconvinced moscow context mean capability bmd sitting congress union sense even change miss however short turned aggression asking solely argued russian omnibus show review time conference forcibly may know raised south bear former news shorter defending individual year significant infamous released adapted region decline several yes american aired bush putin case deployment tv intended laid phased donnelly developed quality neighbor provide stated good quantity asks make appease republican deployed promo forward weapon decided speeding go regarding concern detailed building program jet interceptor offensive threaten willingness economy airliner force deploy europe rohio could effort
3,004-300poundsjobreferenceexploitat.txt,bottle seeing economic say person assumption damned former nice paid worthless year honest character bill used government gouging programme mention hard course comment getting thing best performance award hand written nt change associate business farfetched three value terrified first teaching pocket easy scummiest process investigation crisis parent enough coughingup know someone internship legend mounting unemployable market internwise group many trainee thinktank cash stake applying stopped limited suggesting pay qualification ago around young overqualified lead time skill grandparent earth ambitious money another faint better called came mind spineless advantage prefers unemployed devalued work monthslong spent kind one employment training vote specific signed employable come school application winner stick second hollow collapsed job bar entire rarely lucky sic think reference international sloshing supposedly ok little never upped lack idea naive reading already repeated fee caused catch deal kid easily reason cost considered potential praise bulge invalid civitatis lead ran seem charging hindrance business wanted third made others prove immediately whatever tag get tend degree attached measure mortier people offered damage claim price threemonth message elusive certainly fluke scummy reference hundred like wanting looking worst administrative economy fair attend summer would bribe although extortionate make believe pay education life refusing trying university advertised sadly school practice lie candidate junior gain insists sent intern much ring drunk unpaid anyone tab could needed jan away extra get
4,005-actorartistphilanthropistmymot.txt,know career laughter knowing example done impact year joy blessed important caring six concentration float thing fellow every feather today camp artist nt constantly gift worse three reminded prisoner challenge home fill family selfless endlessly stranger white favorite far focused work air japanese bad energy war live face good see four love smile way wonderful job single lucky thing think philanthropist day year reflected actor whether world complete ii half child truly survived miss would make influence well life day mieke mother grandmother without horrific grandchild holiday always time
5,006-afghanistanatcrucialjuncture.txt,threat simply request take assistance last arm striking provides fighting falklands died objective tokyo decade number apart bastion scheduled annual taliban soldier nato drastic first stay encouraging atrocity engaged bargaining presence accuse taken diplomat eve pakistan come suffering limited seriously broken highly thursday left targeted election slimmeddown peace dozen project counterpart crucial china target offensive face must leave u abdullah large entire suicide international currently fallen staff unorthodox way ally explanation year test attack space jason october led economy reported ashraf japan somewhat india salt foreigner state although opportunity haqqanis death frequently istanbul attack financial chief lowered mission visit afghan pinch instance russia talibaninitiated percent season appearance latter game handed north obama seeing deadly insurgent visible new explained offer safety troop badly government greater proven seen president close blamed public precarious pressure carefully volleyball tarnished next barack semi strengthening bombing monolith possible abrupt departure many amount capture timeline video picture government bonn push lose period making far help april net steam attention battlefield toll publicised slim nearly stark recognition second past move scientist round put bombing dialogue position advance executive earlier world insurgent third unwilling half force direct future time wedge neighbour eu portent able ngo authorised visiting agency violence lifesupport would drive least includes capital throughout effective casualty ghani extent much movement vowed commander redress le bluntly bill aid held conference responsible towards prominent officer network isaf six issue cancelling original foreign every observed part extremely month nt iran witnessed power unity stake week might activity group look largest spokesman continue regional iraq especially secure mixed patron wave district british behind longstanding abandon one war altogether explains pulled come western since persuade ansf thing note spate intelligence beijing manner week also usled province tie context haqqani whatever seek projecting highprofile supposed contribution even change simple assumed socalled level afghan either directed report recentlyconcluded gain juncture pledged site autonomous thousand time conference later london backchannel support member end national year opened effect therefore mounted commitment significant civil flee dramatic thing failed point camp fact worked unsustainable several position mostly base american hamid restricted killed police disrupt security wind overall isil intended contractor flag met intense army political supporting momentum allowing four exaggerating charge five funding headquarters major already tenth strengthen contingent talk run karzai afghanistan investor others insurgency pakistani meagre leaving convene kabul offensive fall credibility quickly force unit killing gone strength different ground effort lyall
6,007-afghanistanconferencewonrock.txt,utilise finally assistance launch threeday paid framework vision lifeline programme tokyo established doubt reaffirm insincerity affiliation decade number best eventual part award administration law deflate taliban system first workshop ensuring mere figure consistently shift eve sincere among capital check raising bulk figure governance establishment attitude illustrate ignored consultant selfsufficient adapt peace project eagerly embassy body given partner human must portion u international fundamental lack little positive head year official potential fight million country implement made report rather competence community euphoria artificial handful offered ashraf population indigenous began offering often state opportunity although funnelling education well let ordinary story yet stable afghan ministerial back diagnostic confidence percent flawed terribly emphasis parallel occasion game handed move million state generous reform new facility technology increase multimillion offer government curb president rule series hand sincerely rock remains public need nurse regime change seeking three girl development access easy overhauling absorb merely indication renewed many submissiveness said dollar complex global staffed ass project government directly mine compromise another recommendation waste monitoring trip local yielding depth approach grateful attention military including budget organisation accusing requires indicating training visit admittedly highlight healthcare second structure sir compromised hired never want phase vehicle cost result portion received ease result direct reform future halfliterate programme afford hefty use published hundred ngo small progress agency concrete would make capital agency boat stability ghani extent much still created decision mutual septuagenarian longterm december contract anaemic checkmark fund commitment uk channelling sigar economic aid held towards highlighting rampant generosity agreement consulting oversight european reconstruction seize comparable reliable original every becomes medium accountability written nt implementing politics utility loses hope expected entity higher radical hype lured continue nongovernmental cosmetic un ensure especially go two impressive graduate need capacity british multitude leadership webpage spent one increasingly since blame constructed regularly irrelevant salary grossly donor feelgood clarified playing benchmark special week also exchange set approach legislative citizen guise similar success inspector abuse page selfreliance following despite pharmaceutical fund flaw conceal chance level afghan either field however rosy report personnel resource turned particular revealed pledged offering site granted review society logic time conference london reunion reveals futile optimism support closing former launched onequarter donor end peaceful individual went based tangible year meeting consultancy known therefore defect trained significant domestic civil skilled corruption failed highlevel point fact region post yes dispensing render hamid fiscal meeting cited side interviewed routine upcoming optimum ongoing misuse examined fraud money suggestion disingenuous genuine quality improvement provide political supporting firm beyond nothing school quantity thus way funding already appointment implementation achieved effort dollar karzai go afghanistan spend told showcased actual irrespective example child building kabul adjustment pour approval disbursing focus general previous fall promised design tmaf expects fundamentally map insistence without assessment could firm sector
7,008-afghanistanreadydrawdown.txt,sustain assistance last logistics biggest fighting twice clear tremendous rate taliban high nato pride additional first inability ensuring struggling crisis skeptic eliminating taken voting fixing nepotism continued indeed governance beginning drawdown dysfunctional confronting spring status start offensive serious agenda must u abdullah alternative imposed suicide international little firstly masse milestone test year require providing attack wanted immediately country implement made resulting ashraf eliminate began majority democratic resentment mission road ordinary key resolute financial chief inherited mission broker wale back instance saved season remain territory sector technical became insurgent oped particularly reducing month state impact tolerate financing new approved government threat inauguration president hold reduction sign next negatively number bombing en nevertheless possible totally analyst anymore many wrote gap gain bonn failure push another exercised tried military signed dependent see factor weather addition gathering responsibility senior adequate transition growing executive heavy insurgent governing force ceo direct reform time people almost able january violence summer endemic make impunity official casualty ghani meanwhile surge much created still upon fire economic brink officer process agreement failure bsa side comprehensive important isaf ahead hard defend improving unity strategic intensified might increase overwhelming order intensify sofa boost admit united two leader capacity came bad one war undermine improvement weaken since intelligence donor characterised caused warning refusal popular morale also symptom resilient province reduce assisting power following despite contribution country level afghan doubted either influence meltdown speculation however resource cabinet gain prepare pledged culture time conference support member former national donor done candidate peaceful year transfer significant commitment civil corruption failed fact secondly american summit hamid cost history front fiscal reduced killed bilateral security upcoming starting landmark democratically sombre wrong address predicted political air electoral momentum beyond thus signing intuition funding ala choice source appointment proved contingent york achieved karzai afghanistan insurgency management declaring partner contribution building kabul survived braved offensive previous elected parliament promotion force terrorist officer without different impacted ground could risk sector
8,009-aftercharliehebdoattackisla.txt,militia know economic say south heinous islamist extremist take affect former act real end right done lip evry state northern conduct issue intellectual tangible side practical website important prime known kind reason woman used whenever thought everything greater ideology unabashedly clear issue tirelessly seen smaller various jihad bible kept likely paying correctly place ca every seems defend today pointed public medium model nt change clearly stemming autocratic shift monopoly number reflects muslim working analysis practice newspaper terrorism sentiment word idea service minister might lot increase possible internal totally know happens radical group eastern tackled many said natural race order islam continue land case iraq committed complicated especially manuel ongoing namely religion extremist keep isil yield government left affair timothy two introduced need jihadism breaking better introduce gaining called result injury local follow ruling individual empowerment much behind carried whose leadership work segment movement political verse military accompanied century one war conflating target producing win aimed daily islamophobia good heard ammannetnet western must addition fraternity fought takween worker ideological large controlled response selfimposed alternative thing little idea positive background strong speech necessary militarily extreme successful deal popular repeating proper also find french produce jordanian way connected effort careful term fight espoused paris usled waged add insult whether world violent level homegrown racism holder silence country freedom speak made finished force arab reform tend rather reflection using long future people battle uplifting independent solidarity satirical form counterproductive certainly sense thinker individually equally action country like change importance cumbersome tackle focus ideology murderous writer concrete antiislamic would youth together although adopt make extremism combined well includes throughout front militaristic applies everyone antithesis effective antiextremism valls radicalism attack struggle obliterate leader us role without france strength true created show culture faith decrease saturday kill le applicable supported audience syria needed reformed arabic effort sector
9,010-americanevertortureagainlawsci.txt,theory obama may secret know ended detail simply sustain obtain finally laudable former last face national real deter state conviction reform took unlawful treatment top imagine limit virtually government protection memo prosecutor clear doubt detainee hosted letter president civil question rule series neither office released place tremendous every name lie investigator fact depended remains written administration site part law nt month representation need doctor barack information refuse law yes ever disclosing forbids first deserve confront topsecret suit evidence sure investigation prisoner dismissed reasonable senate exploited destruction witness lacked indict answer bush torture false prohibition many method order come blacksite feinstein legal security investigation homicide case suggesting landmark prosecutor decade around provided federal investigate keep justice engaging court address played failure method imposes custody united dianne white victim psychologist breaking monitoring leak classifying far legislation individual enforced classification acknowledged cia anything tried political wall prosecuted including december bland legitimately definition contractor war department secrecy revealing beyond staffer weaken lying unethical disclose nearly ability credit unable factor allowing since second u document absurd house single black large crime begin brought imposed make fundamental difficult monday never already intelligence step sufficient press explain want strengthen senator necessary felony classified take harder source staff want reason though built also violation explanation position problem specifically statement subjected unjustified source executive weakness closed write unwilling made report mean phrase reform get obstruction hidden future using community power destroy excludes afternoon interrogation release retaliate congress despite record prevent program allowed even count action country like conceal counsel reliance enforce heavily would engages calling admissible fierce right make either involved opposition full pseudonym argument impunity agency trying let redaction limit scrupulous practice yet criminal reopen officer extent much role without crime ground still location decision site surveillance memory could redacted stand
10,011-amnesiaimmigrationeuropelesson.txt,great closely group poorer ended outlined grim last dealing worrisome problem lived part today mind clearly value first globe crisis presence sweden cosmopolitan among pointing come czernowitz delusional become central indeed multicultural election unemployment recall fixed mingling call alongside start meant given must calm paradox u discovering historian border dominating polish relative lack narrative year idealistic travelling million attack racism culture rise european population community crossroad catholic democratic core overlapped vilnius street yet concerned stable attacked workforce trieste mobilising novelist state new intolerance trend amnesia thought president arrived enclave living populist change background cold hear baffled west common renewed many middle houellebecq contrasted fed complex global nation antiimmigration half across stone discomfort far making help including midst outside kind see grappling writer wake finger smallest decolonisation huge past difficult relate never growing crept homogeneity whether world imagining perhaps ease result experienced future time eu people almost published hundred islamisation worst herodotus day life book appreciating headline surge antimuslim much still le antisemitism economic neonazi devastation religion jew kapuscinski odessa european say foreign tranquillity nt trouble cultural anticipation might inhabitant mosque root occupation era city look continue ryszard ago stranger go anxiety two salonica arguably postwar spent non one war intersection live globalisation stalin hermetic western bring since population immigrant point note greek also matter citizen seem revival imperial border supposed journalist continent read hitler tapestry truly unleashed produced arson like flaw crowd field however frustration turned reflex france true election always changed citizen overpowering time landmass diversity muslim may class language former national automatic dead year invasion curiosity party colony writes thing demonstrating fact appendix muslim knew history enough reduced happens germany open accept disenfranchisement genocide sign literature tolerance provide intruder orthodox immigration reflecting expulsion debate xenophobic demographic question demonstration something faced others cringing ash tony developing message solidarity certainly decency judt explanation old map note sarajevo michel europe different centre nasty could
