,NonCyberSecFile,Content
221,221-rejectedparentsbeliefsidentity.txt,consisting great may know support emerging accepting hostile move witness therapy take affect annihilation face leelah alcorn real network give process tough type rationalise arise new ohio imagine urge concentration build respond rule flee hold possibly tormented party really point living trauma seems part soothed part terrible nt need mind system conversion value grow responding code cast reflects die image baby mercy idea hear parent exactly might accepted possible internal situation sad killed asked someone understood recognised teenage light choose home undergo feel holding family tends therapy persecution case else teenager mirrored accept around unlikely especially approaching young usually deviate money emergency need connection actually help control learn whose anything shame allow camp present bad waiting one rejection start food live upset self view rejected good school counsellor autonomy see unable mode stick blame u rule main large fearful begin thing suicide feel unsupportive think probably influence importantly unconscious friend idea belief growing put harder deal day understand relying inflexible worried find though want identity internet safe pain sympathetic advice go traumatised told others speak listened result seek instead time fear community feeling power people independent despite teenager child emotion sense persecuted able personally away even sexuality often transgenerational like survived importance pas longer find imagination socalled peer happen would together passed although either believe anywhere deviating day book feeling panic going belief everyone resource otherwise walk slowly transgender teacher relationship extent develop fluidly environment created different completely experience forced anyone always danger unsafe strict lifetime le unhelpful mutual meet exorcism time abused soothe get
222,222-religiousfreedomday2015whatour.txt,frequent commitment support person george organization affect last appropriate right maintain freedom saying proclamation state health individual based new return virginia wise important matter home government covenant america place argument president coercion body civil court office place every affirming free today designating part public annual conversation law institution shaped opinion campus authored precious high recognizes regime pillar washington compelled value pubic first fabric served american church formally revolutionary activity senate religious understood promote bush choose many policy heated persecution believed allows men around notably religion greatness shape reinforced fled inalienable originally united friday ministry connection anniversary actually opinion personal better thomas individual enlarge enforced declaration nation statute control reinforces recognize liberty american whatsoever work prioritize grows shall unique marketplace one read champion department start live view given human amendment must celebration founding u house inherent text man event reflect worship respect joined w account past international fundamental belief h prosperity truth understand source contained way year appropriately passage world suffer country college others freedom made encouraged contentious issued direct conscience actual accordance people diminish congress life capacity conviction building profess recognized sacrificing noting dignity observe country like honor simple january pas resolution intent core birth summer state together right grown day well throughout remember enter let powerful otherwise supreme abortion stability school guarantee practice jefferson guarantee within role symbol founder founder seek faith weekend decision culture good celebrate society prayer inspired hobby
223,223-respondingmassacrerevengere.txt,funders tell militia category became group personality aggressive support family may financially peshawar demand face last appropriate countering end real arm usbacked deep solution influential impact affiliation son colony took thrust precisely important path operation government threat greater swat correspond concentration attacker claimed hard question decade citiesvillages likely resulted foreign mercenary associated engenders widespread establish agree medium part case persistent carefully public region direction extremely stronger taliban debate pashtun politics controlling information career worse three first fabric mistrust sentiment primarily inability income unfortunately secular easy educational fame closer range militia simplicity dangerous religious killed analyst scepticism absence punishment group possibility overwhelming many tragedy discrimination fazlullah pakistan among complex scrutiny come backlash check men questioning profile interservices ongoing imperative become across eroding government defence happy school atrocity two leader establishment need organisational available horror call ignored local army misleading response big shred tribal political military supporting camp shortcut politician war area suspicion given spy serious managing driven must wide benefit v funded since population four u fraught calibrated response entire vocal responsibility point past weighed commentator intelligence step growing background repeated general also though posed contained viable broader fact require carry isi sympathetic source broadening homegrown chaos ttp tie action citizen located write surely operative context binary direct result answer appeal drug artificial people pakistani criminal despite sense deprivation collective successive country resolution agency pakistani violence borne state level anyway secretive calling although critically required treated however transparency unanswered well politically agency involved favoured life powerful militant key deceptive effective strategy killing get within role terror much recognise attacked contradiction created different experience completely convincing mullah version society longterm invariably lasting dismantling supported supply societal civilian
224,224-revisitingbritishconquestje.txt,zionist great gouraud ended take example last vision antisemites returned concern prime fighting continuation clear recreating cord part establish epistemic law saladin minister presence mere celebrated punch crescent intolerant played indeed connection declared policy sealed ignored articulating declaration project present crusade confidential telegram consecrates love entered occupied zionism ushering modern large isolated importantly de initially kicked rightwing reportedly ally fight holy attack made led using muslimchristian plan homeland secularism indigenous population began mecca distorted ethnic book story colonialism knight christmas attempt recruited territory descended occasion became cleansing george month new lord reason ottoman troop jerusalem letter critical modernity expansion create settlement theological commissioned information number lloyd memo gate demolition tormenting bigoted religious possible city israel conquest awake alaqsa private capture epistemology umbilical basis confiscation stone period publication furthermore anything allenby discussing movement dated mandate military including clash department title aimed view undertook entering david frame second fought incubated followed zionist past nodding put nakba illustration successful extreme contrary statement lion praise earlier world action crusade complete ran adventure people claim chapter use realisation sharif foothold violence temporary together day book front introduces thinking entitled upon lost commander december get tariq attitude jewish commander interpretation towards crusader jihad jew expulsion european operation campaign advised question written documentary anticipation word occupation extended home coeur illustrated fate avoid land triumphantly around antireligious turkey period massacre two started physical womb british harming wall historic entry one war ali come instructed distinctive constructed palestine victory stepping french one damascus connected set described fundamentalism urge freedom tunnel whatever descriminating historical despite sense prevent produced dignity supporter involved however brief theoretically true holiday refer support south jaffa hussein palestinian national end balfour went edmund biblical conclusion romance course colony coming worked november muslim primary racist contentedly sure confrontation instruction friction expense richard convey intended cross incorporated henri ardent issuing apartheid supporting century headline term date thus strongest describes press idea colonial day dream dispossession forward tomb reminder proclaimed colonisation declaring war building certainly conflict everyday looking general khaki force powerful alliance christian europe settler
225,225-risepolandurbanmovement.txt,scrambled group ended participation knowing recent last town northern area stem programme seat surface various law olsztyn clearly caved first contest engagement bureau fee suit ostroda definite zone green presence demonstrated shift race policy activist inequality introducing approaching central exclusion withdraw growth reverse event ministry election policy newcomer permanent affiliated surviving specific olympic founding uncomfortable town polish impetus cleanliness district gorzow seat year potential dictated bytom implement made eviction lodz community long writing reassert began community managed state campaign calling although torun aim experience leftist saved emerged percent include council hosting rataje became usual emerging say million spectacular month social impact new reason picket removed build hand invited surprise public socioeconomic direction sign pressure zloty winter number three practice development victory vote municipal wielkopolski common city warsaw many wrote said organising elblag capture condition pillar proposal advise foundation called local ruling attract movement sporting budget aimed residential publicised usher collapsed voted followed space translate growing background put privatisation textile low successful implemented result informal received vacant ran force direct occupy eu programme people almost favouring organised publicity insisted revitalisation activist january facilitated budgeting together would appetite least capital official effective industry larger recreational age much movement gave czestochowa decision model nationwide get attitude lay affect commercial formation interest decide line important variety issue harassment campaign olympics place every occupying defend medium blocking politics cultural increasing planning negative transformation activity transport entity inhabitant sopot group candidacy city fate order building regional poland soon electorate centre around tasked started turnout focused big participatory protest one area western housing victory manner transform mainstream popular industrial merged also nup porto citizen grew demand grassroot following congress host even like late comprising level hopeful inform involved combined script squat election active launching show park agreed citizen time situation gradually forum support accepting committee coalition list launched bringing mayor national right retained went individual displeasure year sustainable used party referendum hike party failed threatened proposed derelict coming reap november post permanently according enough main announced considerable parliamentary putting sociopolitical game resident concede consultation civic final control provide political neighbourhood electoral consequence abandoned vote environmentconscious way mobilised preservation mayor alegre formed major setting krakow demonstration forward achievement decided tool democracy formulating spend go neighbourhood authority regarding petition building presidential postindustrial brazilian youth right previous platform poznan promotion quickly referendum urban map strength showed
226,226-russiaarcticopportunity.txt,territory implication great image may north support economic oil untapped finally incurring example airfield recent expedition bringing former arm sphere national early month mineral interest northern went peninsula command pacific asset new year gas area side took based objective concern known increased reduces arctic troop european operation threat fleet significant risk build arrived president baltic course ship place undiscovered surprise rate today case seems flex region destroyed twothirds month track achieve next fish primary hope augmented access radar along advantage base setback permanently activity reserve increase possible disaster presence encroachment reinforce light era taken activity natural consider among icefree option putin limited security offer claim allows estimate scientific refurbished ukraine keep cape sea circle coordinate two tsushima better call plan making search navy control british illprepared step blocked peace prerogative military supporting china one war area century outside beyond ice goal good nearly scope must rescue ultimate challenge glory nature way modern response sue entire asian seven shown inside route currently continues already canal regiment choice onethird ocean low popular doctrine muscle wildlife also via dream maritime journey help problem moscow appears faced year assume whether world go located geopolitical country peter authority others imperial activated nationalism force rise capability future port border battle offered almost post brigade naval japan population use majority even conflict count action like port marine obvious willingness distance soviet focus socalled would cause yearround literally although current combined quickly lay day well rich assigned however interest everyone resource deploy strategy aggression coastline suez vladimir saw russian without knackered still environment harks different decrease back civilian ground russia percent requirement unforgiving needed liaodong get
227,227-russiacaucasusgeorgiaarmeni.txt,easier secret authorisation economic oil caspian south samtskhejavakheti million language instability recent bringing railway last right sphere ethnically pipeline citizenship dismember month pipeline consists based treaty gas account year biggest telling line invasion important crossed consequently fighter discriminated storm bleak mediterranean government domestic issue clear ahead harsh close hold unusually likely causing carrying living becomes seasonal goal poor tbilisi part fact region need achieve strained iran refuse high soldier winter three ever vital exploit first teaching value secondly base september stay additional travel expected closer gyumri transport might west enough increase presence exploited armenian challenge occupation maintains light city activity possibility look many pursued natural middle among ossetia ask policy meddling land ton breed security open strategically karstbilisibaku ago drop especially abkhazia transit lead central become turkey bulk sea separatist time left address failure affair teacher two another unemployment remittance georgian better quality perfect policy legitimate ethnic making bypassing nation timing integrity issuing work corridor military immigration one energy employment live view since due reenergise addition javakheti abkhazian way animosity sensible single closure vocal asian border thing inside feel past difficult respectively importantly reportedthat already step armenia onethird eventually georgian source thanks special easily reason helicopter crimea via also year moscow problem permit ossetians term armenian keeping territorial eye bilingual decreased caucasus province separatism described located wanted citizen costly force issued result future fear long instead rail brewing sectarian freight almost independent form population passport program majority plane placing allowed conflict supplying country crimeans obvious longer sanction annexation reliance proficiency economy divide would drive annexed sizeable make approximately influence believe pass ideal finding sympathy capital force education least prospect residency qualified province ruble georgia passenger recently total attack dozen hour movement europe russian without still culture grievance back language bakutbilisiceyhan decrease russia changed could strain situation later
228,228-russianbankfrenchnationali.txt,oil request recent face give representative name biggest crossed respond steadfast comment really fascist best part shareholder try mind high first reaction included fuelled marine poll english central left election actually data policy mistake ancient farright informed electorate present given racist funded u allegedly modern date sound fascist picked initially rightwing staff libyan head email potential million bargain silence wanted immediately made get led initiative wing pr quite somewhat flying pen fair enslaved although well let yet section financial chairman back russia percent club laugh prague profile team confidentiality feat tomorrow move pipeline gas bet increased citing government protection greater mention stroitransgaz president seen close remains basketball number three unfortunately vote deputy closer client lot west raise ump said amount boast owner private touch antiimmigration directly better called legitimate making ruling help attract budget department view view see capitalism realist realestate andrey never logical round accusation low want eurobureaucracy though identity oligarch antieu substantial running whether direct time eu czech people almost claim company whole publicity gazprom goahead czechrussian would record current day front exaggeration gave get roman held portray commercial interest bank socialist european hollande campaign research getting say suspicion share medium sum nt refuse leading ever fursov construction bratislava word thought might entity hype order fuss surprisingly corporate around deviate two bank leader degree came started decent giant work one win reluctant client western since sensible shown nicolas victory strong call deal got purely also find french colour moscow appear tie expert seem business mean slovakia round francois even like late muammar sole perfectly popov republic opposition however worth turned bit incidentally turn russian france finance football subcontractor later support former launched national news sarkozy year banking used office gaddafi kick institution unconventional conclusion party label course party point seems erupted fact track enjoys forget out yes racist base journalist operation loan pay support address money met opinion bail individual provide labelling political supporting immigration beyond vote wood good term customer funding probably make le idea linked keep question day corporation something considered source chance generally told management developing presidential england survived right drawn quickly irony crash kremlin europe mean translated hack could headed stateowned needed
229,229-russiaoverstretchingitself.txt,property descended impacting north family deadly economic oil move south finally last citizenship subject allegiance ossetias venezuela representative process sarkozy interest tskhinvali agreement state geopolitically service criticised nonuse early sovereignty treaty invasion annexing concern fighting troop european link home six bicentenary boundary established awareness independence leonid government thousand kartlikakheti president died bite betrayal close seen transatlantic getting number paying likely thing foreign associated hand really living point part tbilisi fact partnership case sign carefully region link need pledge november empire becoming first ethically strategic complexity antisoviet encouraging nauru expected ossetian typical persian closer exactly thought might cost toward history religious presence possible creation economically occupation expect recognised common city tibilov group side many said dollar among ossetia policy pending iranian fence mass security soon starting raising ceasefire around abkhazia infrastructure become considering squished defacto hardly happy left nicaragua two united another leader ministry geographical stagnate met georgian abkhaz local army status protest spent military orthodox unique one coordinated war forgotten signed solution found come see brighter must bring dodgy religiously since four abkhazian healthcare u stick occupied streamlined modern shown large seven contrast thing leveled think international receive little never nicolas step roki brokered georgian defense deal low federation implementation crimea cost ironic connected linking year moscow cut reality term ossetians completed million caucasus heavy tiny invaded space country tunnel reneged half others experienced direct treaty severely force regarding future run long community people almost afford linguistically outcome price vladikavkaz building certainly violation even territory change sanction administrative soviet annexation economy would cause annexed road republic marked ethnic either ottoman education day breakaway capital pension burden measure official protectorate alliance georgievsk turned georgia province ruble illegal christian relationship mountain region recognise russian europe still show gave internationally russia confidence kingdom could thenfrench needed time later
230,230-russiapartsolutionproblem.txt,great threat uranium loss oil decision recent last face representative pure vision fragile centrifuge problem list hall strength today part try annual lavrov washington rebel nato first hardship reversal inability engagement verdict minister engaged impose taken balance untold policy certain come believed shape reverse indeed misunderstanding policy beginning peace american volition challenged exact face serious solution anchored must u william uncertainty large respect join border think international accused understand crimea way fear year generated walk caucasus wanted country condemning moralistic led using long effect tension straw often obvious sanction harm fair state preempting premise well standoff limit ruble resilience schussel vladimir chief nuclear perception enriched russia concurred east determine latter aggressive say heart particularly real state impact contain new sauli determined government america mention president berlin misjudge blamed joining living assertiveness facing remains public grip regime carnage seeking negatively blurred cold exactly merely west raise internal trade economically partial pretext discourse many said meddling back global door picture government affair another called abroad development period submission nation separatist disturbance organisation requires view interference perceived opportunity second outflow expressed firmly remained diplomacy huge past misunderstanding never belief built contrary problem world heavy reconciling closed perhaps direct finland force result devaluation future eu people opposite conviction specificity longer soviet together would cause annexed make current life capital trivial interest georgia thinking bigger john speaker mutual guide containing supply december worry desire economic towards affect process blaming commotion aim sovereignty side return consolidation curtain line gaddi hard original foreign belief defend part nt month shaped iran capitalist niinisto closest soft williams enquiry might armenian home interventionists implied manipulate possibility look excuse order regional continue avoid cynicism moved stopped inching around immediate posture admit ukraine keep two united need azerbaijani notsolarge wall join one war stalin weaken come western ability bias since challenge feel armenia moldovan caused pressure also investment postrevisionists moscow player geopolitical seem border power enormous even host nullify country resurgence like change late influence involved pursuit worth intransigence advocating duality argued russian premise always collapse reactivity syria undoubtedly time later tell relation considers personality vietnam south bringing national station creating claiming issue friendly charged independence circumstance thing causing point interview region decline several post aggregate american sure confrontation history conflict side appleman putin case open offer support greatness justness vulnerable revisionist arguing address price mind final predicted political zerosum falling neighbourhood grows beyond outcome way suggested finnish major speech choice sergey georgian evoked traditionalist faced listen water weakness arak expansionism falsely transcend conflict looking economy heavily parliament heightened promised belief iron kremlin lewis assad different could risk
