,NonCyberSecFile,Content
82,085-fiftyshadesofironingsheddingin.txt,stabled blood sex take last face hot encourage grossing small unlike worldwide ascribed gender today boyfriend terrible reheated clearly commuter slave mirror wash happy call wholescale practicality asap porn britain stab must leave u love house basil lucky relative little solo journey likewise paper tv wrapping space owner made rise replaced run swanky chore began often table augury anyway saga going book frequently train yet commute heartshaped christmas hair busy machine stock say fitness arrogance frock coffee new explained top star bleak prude public couplesfriendly regime mamma winter ravioli slippage exactly backlog someone lg girlfriend anymore many plus method complex cycle global version mascara per instinct another display stitched musical favour aimed baffling doddle david see movie past ironing lately despair james implemented though ruined cost statement pain pack world strikingly surely perhaps mutabilis future rethink programme people almost plush score plug eat company whole thigh buy small bathroom longer changing brown would reindeer fifty frozen make trapped day life book inch endless sit recently highest still anyone upon flop le propriety get italian uk tomato galpals ticket popularity woman pub ordered thrash stretch getting bear bus trailer phone couple nt romantic ever flogged bondage travel suspect privacy mia week thought williams might range expect patronising radical home moment heatresistant consider ask importer outmoded beating intimate breakfast two trailer need opponent started youtube giant card erotica work one equipped grey proud come since essential inappropriate stuffed tuesday consumed stranger vanderwaal week got consume match looming unsexy shade one sandwich seem simultaneously nose enormous balk record even basic like bar sale valentine bestselling crowd epiphany midgame softcore clothes turned infatuated maybe struggle tolerant turn always defeat el queue time tell serena inhibition family know option done chess went year declaration used unveiled openly party blooming crimson released warming ca rose drink enjoying treat enough film deputed copy cheese shelf apply wrong cotton friday cooler colour room firm vitamin good sceptical diet torso way gadget day shop compared specifically considered go others creased ereader petal war envelope cover supplying vast general provokes legally realise surroundings household mostwatched fuchsia bedroom laundry isotonic could electronics
83,087-fivewaysobamacouldmakecastropa.txt,absconded ideal ended decision recent last inconvenient give filed callous helmsburton established obligated uncompensated free today part law cuban business high residence law value first nationalized negotiation toward secured know mere property holding suffering court left played establishment ownership follow step american certified commerce semblance inflicted given human divided restore u poorest man lawsuit isolated kicked fallen negotiated socialism refused require potential paper tyrant owner october obtained offered life dispensed ruthless prohibiting sanction core fair propensity repudiated nationalization key commission financial role terror nuclear abused property reparation judging penny obama loss unenforceable demand thief care fairly manifold bond home government everything america hold reign dissolved president plummeted compensable remains roughly model regime assuming development access adversary closer castro socialist possible trade answer confiscated market many pursued dollar scholar legal private condition nation committed decade notably atrocity another victim judge called making far recognize nation authority theft department title restored replicated misguided stole nearly see second wake tribunal indemnification placed put valuation monetary ruined though somehow world half force future people claim equitably billion renounces nebulous published insisted longer soviet sought would current impunity otherwise much upon industry lost get uttered desire fidel economic commercial aggrieved took return bank postunification impossible farm pivotal original decay foreign written nt documented usowned reparation word transformation moment largest consider tends land endlessly especially precipice compensation reclaim normalizing one dirt come driven realistic dictator livelihood someday legitimacy seized humanity truth distant deal raul guise island power recourse payouts congress union even basic retaliated renegade worth broke report theoretically brother studied true accumulated society collapse renew dominated castro thousand away reveals relation may know invite annihilation bringing expropriation end right account exist rapprochement capitulate judgment cuba embargo deed dramatic expelled lucrative several diplomatic yes render american possession occupant evidence ignore history devised germany reclaimed open compensated stolen pay regard revolution program operated permitted control political allow century restitution beyond nothing binding valued admits already want speech day question inasmuch harrowing dollar benefactor democracy store hope others leverage overrule act vast holding economy legally blighted us crime ground continuing could
84,088-foiegrasdeliciouscaliforniaban.txt,harris table plastic cat sexual gratification cage unassuming group ate oil correct particularly held reinstated migratory ethical valley right legendary process social type year bet roman inhumane therefore grand used everything urge tub pleasurable argument plaintiff smelled arrived duck body greek smart brain kept possibly really getting funnel belief pleasure ca sincerely every similarly causing commented animal soup fellow part pointed steel try sake nt stuff fellatio communicate documented ban bullet high hyperbole sauterne worse cultural grow hope three damn first creature animal auger word civilized closer lover aquatic litigating film fry give torture cage wash moment many look said fate among fed suffering barn land freud case dude taking delicious wo around narcotic color restaurant farmer prolonged reach hotel sentient throat jumping imperialism two argue money lower attorney occasionally experientially michael called foie came urine ruling monkey ancient hepatitis hang cruelty shoved god display anything menu minute severe bad california food extraordinarily gavage live center good chef see since feed u love altar wonderful please scientist describe ceramic rarely tube le worship payperview victory songbird put call horrible eventually want week produce preen also abridgment via produce matter boiling forward find hit critic napa foodie vefour water spend judge resists forcefeeding goose civilization liver space hardly culture omnivore half freedom glass mean force result repress minimum chef human instead time kamala people bird forcefed adlibbing sitting convincingly enormous talented price unapologetic discontent eat nibble ban advocate evolved specious use truly able allowed pour basic even produced parisian like contemplate bourdain fin old train tentative general state nervous right although anthony make looked roam believe however fight day well flexible eating poultry turned bit practice shark cook foraging equivalent channel struck lawyer famously referring hideous patient mouth experience presumably culture gras nasty society could banning tenenbaum wednesday time egyptian get
85,089-forgetthegstonfoodabbottneedst.txt,implication messaging group support pension say household coalition entitlement tinkering member recent real punishing highincome give bench indexation impact service health new year age meeting stem top australia fairly andrew smith grand massive government commitment lowest misunderstand lever climate campaign claimed nowcemented solving seen paying forego delighted reputation robb create poor rate free public surprise terrible ppl counter part couple frydenberg nt expanding expensive change need system purse politics leading holistic institute pity mike additional first base secondly income hypothetical levy sure fresh might minister father increase raise lot campbell trade possible higher reintroduction property consider policy ask dreadful proffered come pushing unloseable applying private soon lowincome fixing pay largely raising estimate around broken disincentive ongoing young federal productive complicated keep random per compensation two lessen another white need opposition superannuants opinion rushing percentage macdonald dan better gst wild control nation provide work political approach including fuel budget thoughtbubbles waiting kind labor intriguing food start win abc relief good agenda hoping must infuriating healthcare challenge abbott freshfaced sat paper impression make consumed commentator currently regressive obligation idea narrative scale tehan put call stepping earner gp want easily federation also frankly forward cost investment problem year proposal unfairness potential poll cut ending forth copayment bargain earlier tax surely conservative josh ian others business half folk code owner foolhardy rather appeal promise reform actual instead time people afford almost payment taxing billion company senator even fix fearless tax sale overarching conundrum protecting howard fair cent would right make revenue least budgetary estimated education rich life speculation push assistant current going concession measure short newman highest mp asking coherent baird alive purchase treasurer much argued turn pitch spending mean john unsurprisingly election freefall decrease back inefficient co continuing dean could include income opined get
86,090-fossilfuelsarenocatastrophehav.txt,survive consensus debating frequent perfectbut may fewer benefit placeshis fox oil say career million prestige take highlighting face recent last climateepstein network news give weatheralex creating health went lifejohn issue technology gas biggest year side pmet treatment effect gas problem existence thrilled argument climate harsh gauge say likely getting thing correctly consumer warming antibiotic create storm partly agree today sake improving itit nt disastersif change temperature information cool condemn number weigh comfortably terrified dogma mostly die analysis negative word temperature cost standard absorb fahrenheit week becamein history unusual click increase raise disaster dangerous killed death someone asked dioxide common coastal look many natural amount certain fnc global heated case libertarian coalon largely ago wish catastrophe religion tv young lead wrong earth argue relatively need actually downside droughtsif ob perfect better compare far help rarermost ruining evergrowing big environment abandon signature environmentalist including air attention bad century one viewpoint live greenhouse interference contribute good carbon human see ability must weather planet u document epstein nature man event scientist peopleyou arid flooding modern regularly point think past supposedly difficult thursday condition little never alarmist idea spread weekly humanity altered misfortune livesi caused low thanks source offend rightepstein also master produce thatlet something year appears providing being climaterelated whether world flood water civilization minor fueled desert business miserable pristine catastrophe rather degree human peopleif instead people damage owes fossil safer luxury desirable life able use talking program host shrinking like small change activist longer measured worst focus mainly would record make current fuel winter influence life book let naturally resource draw gassesi industry kill get channel much without crazy show environment always john themfossil accomplishment lost argues regard stossel rapidly moral
87,091-freecommunitycollegepoorfamili.txt,college may family add obama loss support say graduate author aid simply towards take last end maintain universal give candidate state social quarter discount technology year wait member unlike problem government significant pick america president advised student original hand getting paying likely forego benefitted fulfilling debt ca point free today poor public part terrible annual nt need institution system affordable number ever field investment threequarters die american cost expected package grade misallocated tougher asked higher bachelor negotiate give nursing many middle tuition dollar family compensated come forprofit debt security private lowincome attending pay failing drop completing seriously infrastructure decade immediate federal become arrival program skill indeed proposal united two friday skyrocketing money need personal policy available degree ambitious perfect ignored borrow white far legislation focused help anything whopping work stand represent including one grant attendance highway inaction reluctant face solution school bold university unable needed leave albeit editor poorest house enduring insufficient average huge odds lyndon major little rest linked thanks question republican consume also find cost something year class run proposal potential spend steady college reduce catchall outdo tightly middleclass rise result rather amount employer degree seek actively instead community management designed plan people afford offered outdated income leaving participating congress cover act type program even majority fund fouryear often pell fix like addressed vast distributes simple competitiveness progress halftime economy democratic burden attend state would although road make least modest child education quickly university let going powerful everyone twin school affordability yet partisanship financial earnings note much mission mean spending still finance always upon back student johnson meet bill time tragedy effort
88,092-freedomoffencecharliehebdois.txt,represented malek great islamophobic heinous example name shopper clear claimed free today prohibited insisting high epistemic akin value stay crisis anytime smiling depiction suffering credential declared actually jihadism murder peace liberty involving informed complicate weeping protected serious must protect love murdoch purporting man christianity joined narrative stating fallen publish signpost explicit year hit likewise insult appropriately racism speak insulting rather community diverse life validating majority giving opposing opportunity ahmad believe death let key yet concerned attack alive satire deeply proponent saved percent stand directing moral poking determine object framing charlie say bathily subject granting real new care matter build president hold lassana critical living theological tradition three image newspaper sentiment ahmed cartoonist answer print discourse many feel islam pushing global legal fully committed kkk provided narrow another waste period deciding civilisation far attention midst clash view islamophobia behalf fraternity expressed cause crime past connection minority want built hebdo heading powerless problem deeper tweet uphold pain hookednose action mud likeness embrace experienced arab ceo result hero almost claim shortsighted use collective whole published soviet violence listening would cause rightly make day life muhammad industry margin radicalism still remove faith anyone forced responsibility lost fun get image held responsible ethical officer network agreement decide aggrieved took understanding link echoing merabet hollande issue correctly every affirming defend nt contestation wasted aftermath unity editor terrorism asked voice group overwhelming discrimination ask continue soon islamic around young religion hostage impermissible immigrant two focused brother represent one war proud bring since inspiration response mali chose kosher deal matter ending freedom business context fold attached ceremony page edition francois union even equality like change terrorist level republic however short transformed offended struggle argued france true show site sided rupert society collapse time away tell muslim accepting laughter coalition dying defending individual sideline absolute triumph office discussion printing ca cartoon muslim racist sure killed prophet police false esteem case none honouring attempted advocate selecting forgiven opinion concerning carried authentic debate stated way publication press speech choice question proper something listen standing paris store murder grounded others defended release form certainly cover act looking general right terrorist powerful neoconservative voiceless depicting supermarket strategy officer drawing celebrate ground could needed
89,093-fromfergusontoimmigrationobama.txt,group decision voter possession example recent last think whereas underachievement suggest eager today picture law system high first stay included jury bureau traffic senate absorbed race come voting injustice poll justice happy figure promulgated declared actually race american encounter tactic occur electing u house black isolated think illegally profiling narrative positive racial malanga understand year providing street white folk countryman community reported oval majority allowed community ramping giving state behaved survey story dumbed experience betrayed confidence percent moral curry properly obama million stayed saying impact holder new grand incompetent president marijuana insurer likely office living nonhispanic public republican number black gotten cop victimized mr light distancing many feel said discipline legal dividing wellhoned white lower sizable comfortable help nation tried manhattan cynical inevitably nobody bias nearly see nature respectfully voted biased past manipulation stop low initiative problem statement sweep whether perhaps begun force reform people use whole activist brown split record virtual confrontation conquering measure official recently hispanic enforcement much still convincing decision roll recorded le suggests attitude hardening favor stop officer interest agreement side line important decriminalizing path woman crew issue difference hispanic observed medium spite twothirds nt institute deported ever shed thought might boob delivered asked group august look stopped especially young staten impressive personal involve michael percentage involuntary historic one forgotten sharpen improved increasingly population immigrant essential feel soured strong deal numerous statistic decline moreover demand proclamation island insistent corporation even rhetoric country like frisk socalled involved opposition hectoring report reviled africanamerican steve leader turn deemphasizing agreed ferguson unfair review time surveyed selfinterested relation support applied rating welcome end based sharpton year age conducted older compelling fellow poor fact caught worse american undocumented according entail police discriminatory looting acted case successor overall imperative federal wrong arguing resident attorney political quinnipiac immigration divide vote good school turn al rest wooed demonstration republican york elect shooting generally suffer show fashion others congratulation splinter timescbs inflammatory eric africanamericans approval asunder buying general constitute illegal alien declined aspect respondent
90,094-fromguantanamomontevideohav.txt,reintegration uruguayan plea obama usual ceding emerging accepting move pablo south organization rican participation particularly hoped example swap last guantanamo wellpublicised news gross give venezuela name state sister popularity issue lauded hugo known argentina fighter worldwide therefore puerto government escaping six america disenchanted detainee independence issue letter campaign cuba hard clear embargo unusually pepe inmate difference best detention reputation jose goal surprise part fact uruguay medium public unjust pressure oas region panama cuban next barack politics number hope humble vazquez fell first image three insulza along american summit willing tabare prisoner lot idealism main possible salvador leftleaning reflective spotlight reinforce common group antiimperialist city possibility speech many latin said consequence operation come sentence regional represents coverage open planned reconciliation exodus accept raising around decade highly unlikely ongoing considering become exclusion arrival miguel mujica left unpopular government reverse impressive two secretary chile leader beginning backyard neighbouring colombian bloc yearsold gesture apparent aspiration whose peace april political attention resettled one read favour rejected given goal ascendancy agenda stance alan perspective term unprecedented asks second u way forty reflect landed word ideological five montevideo imposed colombia neruda reference international think farc probably odds already washingtonbased spread tenderness national republican also compared find talk ally unilateral isoluation publicly year controversial lifting one proposal quote informal landing received ethic world country humanitarian made perhaps october led instead power people peacemaker working release following astonished historical solidarity welcomed able coexistence ostracism even host country brazil chinese heterogeneous progress late managed general attend chavez would although refugee day life well hinted syrian extraordinary recently larger legacy sent organisation progressive referring detainee aim still different back leftist el ground could thousand spanish fascism get
91,095-frompanamafergusoncounteri.txt,illusion relation machine fire became immigration family support loss george heart south finally demand national right officer early state interrogation dead new invasion cofounder taskforce line conducted known defy lived massive government significant determined ferocious domestic facto build awoke president body smaller court descendant say really stand failed densely assault place fire free panama fact firing ghetto establish referred unchecked part region destroyed destabilise accountability arrest smoke communicate liberation capitalist knew mike value resistance racist afropanamanian globe garza scene barrack empire restricted zone destruction generation reflective police city bush airborne taken remembered consequence hit order continue component represents domination global limited stopped security investigation ensure nation gun largely ago centre manuel sober central ongoing across justice project defiant defence policymakers nicaragua department united need disabuse characterise twenty policy met involve perfect anniversary came whose racially work political obedient neighbourhood military project including century quick antonio tactic training hegemony body custom human must term audacity scope bring western planet element u excessive structure way worker servant brutality black noriega sound biased criminality five w point repression palestine international lawlessness alicia invade never canal de h colonial necessary linked understand refrain labour head subsided special also find elite matter cheap effort year publicly confined intimidation reality reminder invading world invader integral country others agent authority made experienced unipolar issued force demanding devaluation community harbinger programme border power people garner ajamu homeland long blacklivesmatter despite life sovereign unleashed use able vigorous division eric rhetoric community like execute importance train globally late general murderous violence state score victim would barrio brown populated panamanian sanchez opportunity outgunned marta shoot strategist remember life capital force throughout powerful interest director turned demonstration enforcement quicker aggression yet baraka attack criminal caribbean struggle periphery particular crime still experience internationally ferguson pretend el chorrillo warrant lost kill le thousand december time later civilian
92,096-generalelectionpartyleaderssho.txt,relation great katwala may group know benefit support articulate say move voter simply coalition responsible spectrum right london month priority social decide quarter new certainty year ethnicity line worryingly offer prime strategist differing important reason fails engage matter government six everything disagreement tribe issue argument greater gender uncertain campaign course coast party every today ukippers hand partisan try public illuminates nt confident uncertainty debate next politics enlightened gift three mostly pole damaging conversation verdict sure tone vote hear minister might enough polarised loser possible interrogating know challenge asked expect voice common give electionyear gay city many islam come gap handle voting open wo tribe poll committed overall become thumbsdown sunder across reach indeed share basis need opinion appeal selfinterest british nation big dislike leadership approach political electorate attention scared politician immigration waiting war debate beyond view look govern nobody good britain vote ability advising misunderstands generation geography since four u arid uncertainty response strongest shown helping contrast omitting thing farage brought think secures victory step put capturing anybody understand labour want pressure also find identity everywhere broader class decided democracy running set whether go citizen seem conservative speak half made governing demand conscience appeal future long ironically conservative power people outcome canvasser sense talking majority theme fractious like change grid democratic economy core state supporter would engages make either appetite ideal day winner headline script director finding nigel yet stable much leader without different election culture anyone still ground changed nh society confidence could meet difficulty overestimate get
