,NonCyberSecFile,Content
157,157-militarycourtspakistan.txt,theory scrambled group threat ended decision simply take finally face rendering theorist prime established innocent clear doubt claimed undertaken number beleaguered similarly rate today try convicted law mind system high jurisdiction khan fell first confront blast scene minister ten mere scepticism taken antiimperialist cordon memory pakistan come solved notable become justice havoc trundled court consequent pakhtunkhwa familiar establishment declared available plenty vendetta manipulation recanting judiciary present airwave challenged crucial hijacked posse khurram body given martial kidnapping solution zia flew protect must u worker black rarely antiterrorism suicide little narrative pursuing district staff nine year fight providing attack transferred refreshed made convict october fear long obtained allowed alone often surrounding fervour conspiracy fair writer normal adjudication premise roam let death wreaking outfit attack chief languishing terror witness lawyer bomber percent target profile moral bit mobilising muzzling handed north secret islamabad month new fairly dreg apprehended protection seen court contravening office announcement hundred case public hand need carnage next ban information bombing condemned deputy agitator prodemocracy march many middle perceives meddling complex paranoia legal condemnation basis white judge better period pro tried military concluded arrest requires goal nearly statement see second evil rule crime turning see massacre plain never opposed bombing low produce via hour problem heavy closed holder result hero untainted measure people adjudicating participating conviction precedent acquittal hundred activist sharif presented happen would serve extremism machination grotesque jacket front measure official nawaz much created gave forced civilian december tragedy mastermind judicial early shoulder conduct leaf took impossible issue foreign place every nt institution achieve power aftermath flogged terrorism along ailing death lacked group activity home consequence ensure adjudicator go ul detention khyber accountable two united came mayhem whose work whetted one war winning win altogether obtaining forgotten largescale weaken since blame constructed regularly marathon irrelevant desperately piece instrument bullet undermines distant special easily procedure also matter everywhere controversial latest moreover capability power paltry supposed unleashed even produced like country change auspex terrorist banned exhausted however heart confused leader punished logic undoubtedly thousand situation time away championing later wornout may unequivocal task denial peshawar murkiness extremist conviction punjab year meeting grenade openly subverting prosecutor party transparent suffered pleading harassed trial several worn evidence promoted ignore according haq parliamentarian journalist witness charge history happens police sticking false lobbed security case open resurrects operating vulnerable extremist opinion room suspect fired army political secrecy heard school found sort paper inside burgeoning make concentrated already press spread fairness principle coup necessary hideout day forward something democracy acquittal lead instead ultimately pakistani ransom certainly program excess old general thousand grown terrorist province hour sidelining schism illegitimate imprisoned could exists
158,158-moscowcollapsingpowerdream.txt,exchange commitment plot north peak economic oil move particularly last gamble recent miscalculation gross end venezuela station month assume social quarter year account doubled domestic america seen dramatic announcement share point rate surplus destroyed iran smoke subsidised value vital additional development investment first confront negative punish screen saudi week crisis according might west increase market balance order continue putin global sanction security plummeting estimate inflation shale ukraine vulnerable considering across per indeed import two another ministry need price rouble beginning policy package production development far american fluctuation budget bad consequence arabia energy war hypnotise misfortune food revenue voluntarily play since u collapsed origin plunging flight barrel past caracas already breakeven monetary day tar also oildependent expansion moscow dollar tehran paper set sand world june level country product conservative space half concern investor resulting wedge economy developing price independent sharp balancing population dissuade even shrinking like crude rapid economy state would previous record marked revenue current capital force opec coupled design kremlin financial gone russian spending mean shock finance decrease good russia lost confidence percent supply situation sector
159,159-mosulcitydeathrow.txt,oil take finally vision shia mobile resident telecommunication prime risk tremendous suggest today part terrible destroyed mind system high soldier testified premier isilstyle minister dangerous come retaking coverage conscious elsewhere competency become happy governance argue anniversary nominal arrested dysfunctional isiled trail present food given must protect attempt imposing u shot gender black large alternative joined imposed currently accurate page reportedly year potential fight street conservative prompting dispelled near rather october led long feeling sectarian initial reported often spoken bearded state education death inclusive strewn yet kurd within looted back prayer mosul appearance east obama north governor sky priority social pipeline learnt new nuraddin trend offer troop bleak home appointing government incredibly president rule remains public stare becoming barack information graveyard struggled art easy deputy idea city commonplace march said middle complex nouri capture picture mark men ousting across displaced another better local far help attract military play second sixmonth move opposed agreeing put low caliphate aleppo sweep perhaps governing force appeal future people pull able tax progress hate split would serve make estimated manages capital front retake effective alabbadi bigger december isilcontrolled fallujah held swapped agreement journalism predecessor foreign crucifixion every redraw brave nt institution monitor sparked paint emergence fate iraqi order wo seemed iraq sharing stranger young segregated row ghost two need opponent begin enforced disillusioned leadership work severe one war area win forgotten western ability trigger alqaeda enduring destructive dynamic supposedly intelligence harder warning also swift resilient hijab simultaneously similar shrine seek battle weary even country like chance level banned refugee rubble heart antiisil report sunni shortage turn particular kaplan collapse citizen dominated syria time coalition sensitivity member end issue raqqa smart civil functioning threatened region november disappeared worse evidence history gun boldness haider police guardian propaganda hit operation taking estimate isil resident defence flag met mind control army tribal political allow school immense shut bitter kobane inside sooner suggested al capturing proved forward almaliki decided weapon piece water june strictly nationalism warplane subject management leaving aside conflict abbadi execution focus economy corner pass quickly irony urban fundamentally map strategy christian showed rejuvenated
160,160-muslimsfrancecharliehebdome.txt,latter actor manifest underpinnings provocative muslim islamophobic handed family slaughtered interpretation magazine charlie absent countering newsworthy million centred life bernard highlighting prominent subject face national act disparately laicite deviant news wolinski cabut functioned representative name aim based biggest contradict top woman asserts eviscerated office codified bodily harmonised hold expression compelling civil barrage firestorm likely ultimatum apart save inserting place perpetrator medium rabid link structural mind representation exclusively ban condemn muslim three additional first vile voice job infused pointblank rebuttal idea merely ahmed west borough cartoonist religious archetype killed mitigate competing figure charbonnier considerable banner choose discourse celebrated tragedy overwhelming outsider islam come pervasive polity backlash coverage claim niqab gun spurred architect especially centring land focusing religion provided become ongoing relevant expression indeed targeted representational demographical connection policy victim retelling percentage ignored headscarf civilisational far legislation exercised fervent declaration behind nation frenchman alike considerably longstanding size political minute fuel politician severe firm one reveal stream vicariously unimaginable valour islamophobia nefariously frenchman baseline perspective george second shot subversion editor addition evil constructed modern entire followed draconian expectedly insert headquarters importantly odds already heroic narrative refutes hatemonger enclave extreme emanating shooting jean also french forward hebdo identity rigidly everywhere broader stephane carry reconcilable standing paris million resilient violent world citizen covering located simultaneously surely marginals guise binary rise illegalisation policeman collateral conflation existential instead time killing innocent victim almost unyieldingly secularisation caricature following satirical secularism executed ban sidewalk population lawabiding assassin despite villain majority merabat verlhac everyday victimhood community country obvious malignant comprise terrorist core violence state identity would disconnected narrative although verbal looked amid broke life bigotry chilled death report headline caricature front terrorist statesponsored purged embraced story attack irreconcilable within incite france ramification culture citizenry upon complicates faith model impacted strident society ground citizen responsibility percent liable indictment wednesday stand integration
161,161-mybraintumouracousticneuroma.txt,finally take knowing face rightsided give acoustic escape body apart carrying rate part devastatingly moment satisfied headon frightened grow first stay checked wishing taken vice memory balance certain come suffering planned promotion become thursday alarmed speaking slowgrowing facial call skill scan improve tumour food voluntarily relief e telephone must stupid university love black sound bleeding think dominating sedative lack reading pursuing head year thankful careful determination express drool space speak made rather feeling long fear plan fine neuroma obsessively life obvious jump spoken normal calling believe well let eyebrow key bother commute within inherited hotshot drunk experience back busy team seeing loss say nowadays sister married induces new searching letter close hand brain cooking thankyou loved dart grip mess uncertainty becoming doctor picking tell inmate three neuroma number background art postop closer relating unknown intimate trusting someone sorry said amount feel across acknowledge hearing noticing mine vain lose better wild far remaining help anything woken size grateful attention dad snail restored nearly admittedly see unsteadiness due paralysed smile wake second cause difficult move never growing navigate put lacuna eventually gp though boiling certificate identity problem hour carry hospital result running action write kindness half experienced hidden weakness liquid people almost fitted arduous sharp wood able shake physically whole small listening would make difference least manages life book cracker panic mother slowly much movement counting still referral blink sensation fluid nh le husband get losing worry pose tumour lot stop pretty prominent morning untrained cup leaf side bank neurosurgeon path spurt six wear place rough say surrendering every brave register phone couple nt refuse nerve leading ever animal word dithery rush personality week might benign voice shaved group home moment look overwhelming ask stopped goodbye wo soon favourite manage ago stranger especially usually coordination nick paralysis two need degree sagging horror came behind big work brother scared bad one live worry daily metaphorically since feel nerve definitive strong call kid week got diagnosis diagnosed find embracing symptom one strangling eye doctor ear mean listened delay fade power woman sitting prison read boring type even like change expressionless mouth dinner mile miss loud involved full trying draining prognosis frown cook teacher confused turn revealed burning overpowering busyness time away later london tell set breast may know support tinnitus raised end news creating went illness year telling sleep tea trained lump sore depending thing ca happened coming felt worked november treat urgent pace yoga sneeze imprint worse knew tenacity possession spill permanently history main faxing reduced righthand choose operation interruption cheese open taking else brain wait schedule luxuriating wrong weird gown room met watching settle nothing practise good found asks sick emptybellied probably brought catch fatigue craniotomy speech choice take day parttime something internet reality listen run cancer surgeon go numbness told others happening finished shunt instead neurosurgery deafness child old clearing focus corner eaten right fall realise ready approached powerful hour sent mean prolifically freezerfull
162,162-nationalgalleryportraitinequal.txt,easier cameron impressionist group loss decision pc participation recent profit last appropriate give paid tough northern provides galloping predominantly posturing risk decade number widened workplace rate free part artist wealth osborne value negotiation ensuring willing supplier mere figure accelerating wash strike threshold workforce drink tangle central proportion earned evening growth essential trustee penny amended admitted soared inequality food britain booking leave u servant temp colonnaded bogus think little staff close year worrying require rate transferred near report rise promise employer weak long outsourced offered wing population cut ftse ruthless majority newer democratic calling let painting assistant guide commission irksome yet trustee chief insurance company nuclear intern christmas back profitability gallery visitor remain poking restoring tory splendour george million visitor real spoke fashionable new crushable website top reason lump nowhere deliberate government protection letter student paying living public hand precarious sign need preference inhouse uniform information next tell article practice vital spreadsheet banker art west unknown many said manager gap private men version breathtaking prudent across oxfam systematically advise lose foundation far help nation april kind view capitalism echo huge hired condition ballot privatisation undertaking low empty selfemployed grant zero world earlier tax regulation result time people unionised almost pull afoot company buy wrest wage january treasure longer rowntree worst agency changing mainly happen would make least day life includes eating highest larger fiveday sway still patient lowpay danger longterm lost le poussin contract get uk norm economic executive guard commercial bottom untrained service sainsbury took woman echoing realm beat hard question campaign invisible say every nearimpossible couple guard fright hope ever job wage week asked expect higher city look consider unsure demanded building sector favourite rembrandt centre protest item keep serco share two eliminated came selfinterest decent work emblematic fortnight one explains wellinformed since average salary shedding ben call van joseph popular labour also french complaint exhibition set eye latest squeezed equalised corrected power union museum sense even like dirty glad find break younger sham epiphany full anywhere radiates always show unpaid park society income time away london family know south classicist cigarette former tuc national done heavy instantly went trafalgar tupe year older tea transfer used hivis sends ditherers derelict glorious resist worked cast mostly holiday stopping council chair according gdp happens side security car taking pay earn union money talk male membership civic break strike squeamish falling firm consequence century contractor gogh employment school term earning event fearful brought inside squeeze already nicholas rest take choice unduly hardest something minimum automaton reality run attachment go square told ethos minimum instead management employee trashed davos child decency importance old focus nervous attendant fall treasured tender assistant dishonesty acas everyone director ci powerhouse supermarket note hour sent female mean manifesto could extra
163,163-natonuclearrelapse.txt,selfdestructiveness improbable accuracy simply famous recent arm mark rendering provides precisely returned concern struggle bark problematically programme claimed body bite thermonuclear soar flag shield warns free part administration today habit lavrov clearly washington high soldier stationing nato first crisis minister incident bargaining pouring extension test superpower race policy certain activist come urgently symbol planned topic shortrange elsewhere highly sleeping central manoeuvrrs overlook indeed event argue declared critic plan call deterrence skill stood peace nuke status politician soared exact guided start meant given relief interestingly suddenly britain village armed attempt university u onetime man large briefly rarely involves anecdote international puzzling currently continues tactical little parading lack greeted rusty understand socialism crimea test year identification addict precision collision window expressive wanted college near rather plan initiative afternoon simpler obvious state mission calling remember well soil kerosene frequently pretence story walk lie yet smile nuclear role nostalgic back bomber shortly russia visitor target moral east exchange game opeds obama secret say attraction particularly architecture farmyard sky real frighten state new ballistic baker increase safety removed everything threat replace horizon president rule berlin student likely remains public sign need preoccupied emotion tell joke number cold gorbachev ukrainian deputy west answer fortification quiet herd global submarine involvement representing sergei perform mentioned tourist across intermediate government originally compromise another village local remaining learn scrap april movement military battlefield twang kind silo attended training play belgium signed see wide aptly wake structure wire twentyfive problematic never smell altered moving aircraft want doctrine general via heading identity position deafening shiny readiness world thunder scramble force treaty memorialised distraction future disarmament people netherlands prompted use small missile speculate happen would cause rightly buchel make life front nonproliferation purpose recently missile industry larger much still john created language fiasco danger mutual audience december charming underfunded uk desire relic prevented spectacle deer early failure excited delivery notice infancy light member important sell european link bunkeresque variety issue initiated function predecessor garden foreign lie system site nt month power increasing field strategic airlaunched spun might range increase prompt quo spotlight capable eastern home implied possibility speech shea largest look conventional missing relapse ask tends regional hang sharing ago around go posture muddy admit ukraine rhetorical turkey assure flockhardt modernise two secretary need barbed intercontinental weapon succession behind abandon uneasily wall landmine one biting war undermine explains stoltenberg come western brussels midair since highspeed localised explain victory stepping transform storage pressure also one moscow controversial emotive surprised creep latest context nose page power modernised prison despite even reduction laugh like dog late mikhail chance scotland proxy short location russian prepare versatile always existing time london relation may modernisation task member welcome annihilation end jamie denuclearisation issue yield known reset bush unintended gaddafi militarism independence course kept stand modernising seems lest november precious antinuclear primary forget base american kerry dramatically escalation absence schoolbook germany scrutiny fence putin security trine cloud plane serbia advocate revision concede talk milosevic hang provide festivity century abandoned quick debate nothing chip thick way put want shop insecurity house violation talk something publicly weapon decided go afghanistan told agent gravity designed ultimately glimpse declaring concentrate partner nonnuclear form jet division conflict italy old general heavily fall warm approximately lethargic enter assistant bomb fundamentally alliance balloon lesson kremlin airspace sent joint hawkish europe could
164,164-newcongressmyfellowrepublicans.txt,oil take ammunition tough provides really administration try business first toward rein senate nonunion caucus limited voting employer firebreathing lead become election plan mcconnell regular project start given agenda divided protect commonsense u house keystone selfimposed bipartisan importantly continues shutdown defense distraction year likewise obamacare immediately rather tarnish majority occupant enrolled democratic fair passed let going within hat ring back obama motivated move pocket real month social impact pipeline health state new cliff top care grand government memo president series trust alleviate critical create floor surprising need republican next tell thorough vote light many boast rolling pushing mark count government unwelcome white called help nation nominee including mandate department forcing deficit see amendment opportunity plentiful letting helping responsibility past put moving low problem result running executive hire tax regulation direct result hero measure future people rid able throw small january progress brand happen would difference va make current day capital interest gridlock much counting john speaker roll supply bill mandate get responsible stop portray heartened process agreement took path six impossible overreaching gop getting debt foreign associated returning ever job week increase radical era group unfortunate overwhelming largest order newly harry keep exempt unite two leader need robust focused leadership hurt work one area win come ability since challenge bill job destructive step strong harder also matter environmentally dysfunction reduce encouraged tenure fringe power talented congress even country simple break late muscular influence full impede leader pledged show bottling goodpaying time democrat support mistake hiring lurching member bringing national winwin candidate issue minority domestic petty party reid thing failed veteran yes american sure history majority taking extremist empowered union money price legislation control sound vote good succeeds issueoriented begin already order xl republican divisive house forward repealing reality standing chance minor falsely prove instead retaining docket act importance slew learned old focus right elected reestablish politically mitch boehner without
